{
  "id": "trigger.patrick.harbor-contract-stale",
  "source": "scheduled_review",
  "created_at": "2026-04-28T14:10:00Z",
  "actor_ref": "persona.patrick",
  "summary": "Scheduled operations review found the Harbor contract record lacks explicit owner, current stage, next action, and canonical Drive archive reference.",
  "payload": {
    "review_type": "operations_record_hygiene",
    "record": "Harbor contract obligation",
    "gaps": [
      "owner unclear",
      "current stage unclear",
      "next action unclear",
      "canonical Drive archive missing"
    ]
  },
  "evidence_refs": [
    "sampleco-process/pipeline/ops-manager-operating-model.md",
    "state.sampleco.contract.harbor"
  ],
  "candidate_state_refs": [
    "state.sampleco.contract.harbor",
    "state.sampleco.operating_picture.ops"
  ],
  "candidate_memory_refs": [],
  "persona_ref": "persona.patrick",
  "governance_refs": [
    "governance.contract-external-action-approval",
    "governance.source-of-truth-discipline"
  ]
}
